Parcel Number,Name,Address,Sale Date,Sale Price
101-0006-0148-00,"CHI OMEGA CHAPTER HOUSE ",307 JOSELIN AVE,1/1/1900,$0
101-0006-0119-00,"CHI OMEGA CHAPTER HOUSE ",311 JOSELIN AVE,1/1/1900,$0
101-0006-0101-00,"EPSILON CORP OF THE THETA ATTN COLLEEN ",312 JOSELIN AVE,1/1/1900,$0
101-0006-0078-00,"KAUKAB MUHAMMAD IGBAL & ZAHIDA P KAUKAB ",316 JOSELIN AVE,3/19/1990,$0
101-0006-0079-00,"OHIO THETA HOUSE CORP OF SIGMA PHI EPSILON ",321 JOSELIN AVE,5/21/2015,$0
101-0006-0134-00,"ROMAINE APTS LLC ",351 JOSELIN AVE,8/14/2009,$0
