Parcel Number,Name,Address,Sale Date,Sale Price
600-0021-0060-00,"SYCAMORE TOWNSHIP BOARD OF TRUSTEES ",PALACE DR,1/1/1990,$0
600-0021-0052-00,"KUBICKI CHARLES J TR ",7800 PALACE DR,10/26/2006,$0
600-0021-0075-00,"LANDY LEGACY GROUP LLC ",7811 PALACE DR,3/7/2012,"$572,000"
600-0021-0051-00,"ALTWER LLC ",7818 PALACE DR,3/23/2004,$0
600-0021-0050-00,"BLUE ASH COMMERCE CENTER ",7820 PALACE DR,6/1/1984,$0
600-0021-0077-00,"SPECTAPE OF MIDWEST INC ",7821 PALACE DR,1/1/1990,$0
600-0021-0084-00,"SPECTAPE OF THE MIDWEST INC ",7821 PALACE DR,2/1/1985,$0
600-0021-0078-00,"BLUE ASH COMMERCE CENTER ",7841-7855 PALACE DR,6/1/1984,$0
600-0021-0079-00,"BLUE ASH COMMERCE CENTER ",7865 PALACE DR,6/1/1984,$0
