Parcel Number,Name,Address,Sale Date,Sale Price
238-0004-0036-00,"CORPOREX PARKS OF OHIO INC ",HIGHLAND RIDGE DR,1/1/1970,$0
238-0004-0043-00,"CINCINNATI CITY OF ",HIGHLAND RIDGE DR,1/1/1990,$0
238-0004-0045-00,"CINCINNATI CITY OF ",HIGHLAND RIDGE DR,7/2/1992,$0
238-0004-0042-00,"ULTRA TECHNIC SERVICES INC ",5830 HIGHLAND RIDGE DR,7/18/2012,"$70,000"
238-0004-0041-00,"REGIS HIGHLAND RIDGE INC ",5836 HIGHLAND RIDGE DR,10/3/2012,"$1,937,500"
238-0004-0037-00,"REGIS HIGHLAND RIDGE INC ",5845 HIGHLAND RIDGE DR,10/3/2012,"$1,937,500"
238-0004-0038-00,"BAERLOCHER CHEMICALS OF NORTH AMERICA INC ",5890 HIGHLAND RIDGE DR,9/29/1999,"$803,200"
